{"$id":"QK_GBFP8_HEAD64_GRANULARITY_SWEEP_EXECUTION_V18_C02_BINDING_REPAIR_FRESH_L2_ACCEPTANCE_SCHEMA_V1","$schema":"https://json-schema.org/draft/2020-12/schema","additionalProperties":false,"properties":{"acceptance_sha256":{"pattern":"^[0-9a-f]{64}$","type":"string"},"accepted":{"const":true},"action_id":{"const":"ace2:qk-gbfp8-base-v18:static-c02-binding-repair:additive-0001"},"artifact_kind":{"const":"qk_gbfp8_head64_granularity_sweep_execution_v18_c02_binding_repair_fresh_l2_static_acceptance"},"binding_table_file_sha256":{"pattern":"^[0-9a-f]{64}$","type":"string"},"candidate_report_sha256":{"pattern":"^[0-9a-f]{64}$","type":"string"},"claim_boundary":{"const":"STATIC_ONLY_NO_EXECUTION_AUTHORITY"},"decision":{"const":"ACCEPT_STATIC_PACKAGE"},"fixture_report_file_sha256":{"pattern":"^[0-9a-f]{64}$","type":"string"},"manifest_file_sha256":{"pattern":"^[0-9a-f]{64}$","type":"string"},"official_payload_open_count":{"const":0},"official_target_process_starts":{"const":0},"reviewer_role":{"const":"Fresh-L2"},"static_acceptance_grants_execution_authority":{"const":false},"v17_retried":{"const":false},"v18_executed":{"const":false}},"required":["acceptance_sha256","accepted","action_id","artifact_kind","binding_table_file_sha256","candidate_report_sha256","claim_boundary","decision","fixture_report_file_sha256","manifest_file_sha256","official_payload_open_count","official_target_process_starts","reviewer_role","static_acceptance_grants_execution_authority","v17_retried","v18_executed"],"type":"object"}
