{"acceptance_sha256":"601980bd0a7af5040c1ad07c9ea88e6aad71619326574436175419637fe74e12","accepted":true,"action_id":"ace2:qk-gbfp8-base-v18:static-c02-binding-repair:additive-0001","artifact_kind":"qk_gbfp8_head64_granularity_sweep_execution_v18_c02_binding_repair_fresh_l2_static_acceptance","binding_table_file_sha256":"87ab3deb25f77d89b0797d72004b4436f9541987da13a42f44a2bff7f9fa9655","candidate_report_sha256":"fa35b0a3508025d67370e0f5e4adbf2b7ca209b4c0c22601475dbbbb8597b0ea","claim_boundary":"STATIC_ONLY_NO_EXECUTION_AUTHORITY","decision":"ACCEPT_STATIC_PACKAGE","fixture_report_file_sha256":"16562e14890da5ceb84b519a86b85231741e33751301d4695d4d885a8b1dd606","manifest_file_sha256":"fdfc33a1443f237fbaca882b13fb977ae3c2ad7f61e427453297d0621f4445c8","official_payload_open_count":0,"official_target_process_starts":0,"reviewer_role":"Fresh-L2","static_acceptance_grants_execution_authority":false,"v17_retried":false,"v18_executed":false}
